{
  "status": "ok",
  "service": "game-api",
  "project": "arena_ops",
  "environment": "production",
  "interface": "meerkateer",
  "interface_version": "1",
  "version": "1.0.0",
  "build": {
    "built_at_utc": "2026-09-27T00:00:00Z",
    "git_sha": "0123456789abcdef",
    "git_branch": "main"
  },
  "checks": {
    "database": { "ok": true },
    "redis": { "ok": true }
  },
  "timestamp": "2026-09-27T00:00:01Z"
}
